{
  "$schema": "index.schema.json",
  "package": "@goodui/angular",
  "version": "0.0.1",
  "generatedFrom": "angular/projects/goodui/src/public-api.ts",
  "components": [
    {
      "selector": "[goodCardActions]",
      "className": "GoodCardActionsDirective",
      "file": "components/goodCardActions.json",
      "import": {
        "package": "@goodui/angular",
        "symbol": "GoodCardActionsDirective"
      },
      "usageGuide": null,
      "penpotCount": 0
    },
    {
      "selector": "[goodDropdownFooter]",
      "className": "GoodDropdownFooterDirective",
      "file": "components/goodDropdownFooter.json",
      "import": {
        "package": "@goodui/angular",
        "symbol": "GoodDropdownFooterDirective"
      },
      "usageGuide": null,
      "penpotCount": 0
    },
    {
      "selector": "[goodDropdownHeader]",
      "className": "GoodDropdownHeaderDirective",
      "file": "components/goodDropdownHeader.json",
      "import": {
        "package": "@goodui/angular",
        "symbol": "GoodDropdownHeaderDirective"
      },
      "usageGuide": null,
      "penpotCount": 0
    },
    {
      "selector": "form[goodForm]",
      "className": "GoodFormDirective",
      "file": "components/form-goodForm.json",
      "import": {
        "package": "@goodui/angular",
        "symbol": "GoodFormDirective"
      },
      "usageGuide": null,
      "penpotCount": 3
    },
    {
      "selector": "good-action-group",
      "className": "GoodActionGroupComponent",
      "file": "components/good-action-group.json",
      "import": {
        "package": "@goodui/angular",
        "symbol": "GoodActionGroupComponent"
      },
      "usageGuide": "guides/components/action-group.md",
      "penpotCount": 1
    },
    {
      "selector": "good-action-menu",
      "className": "GoodActionMenuComponent",
      "file": "components/good-action-menu.json",
      "import": {
        "package": "@goodui/angular",
        "symbol": "GoodActionMenuComponent"
      },
      "usageGuide": "guides/components/action-menu.md",
      "penpotCount": 2
    },
    {
      "selector": "good-alert",
      "className": "GoodAlertComponent",
      "file": "components/good-alert.json",
      "import": {
        "package": "@goodui/angular",
        "symbol": "GoodAlertComponent"
      },
      "usageGuide": "guides/components/alert.md",
      "penpotCount": 3
    },
    {
      "selector": "good-app-layout",
      "className": "GoodAppLayoutComponent",
      "file": "components/good-app-layout.json",
      "import": {
        "package": "@goodui/angular",
        "symbol": "GoodAppLayoutComponent"
      },
      "usageGuide": null,
      "penpotCount": 6
    },
    {
      "selector": "good-avatar-menu",
      "className": "GoodAvatarMenuComponent",
      "file": "components/good-avatar-menu.json",
      "import": {
        "package": "@goodui/angular",
        "symbol": "GoodAvatarMenuComponent"
      },
      "usageGuide": "guides/components/avatar-menu.md",
      "penpotCount": 4
    },
    {
      "selector": "good-avatar-menu-item",
      "className": "GoodAvatarMenuItemComponent",
      "file": "components/good-avatar-menu-item.json",
      "import": {
        "package": "@goodui/angular",
        "symbol": "GoodAvatarMenuItemComponent"
      },
      "usageGuide": null,
      "penpotCount": 3
    },
    {
      "selector": "good-badge",
      "className": "GoodBadgeComponent",
      "file": "components/good-badge.json",
      "import": {
        "package": "@goodui/angular",
        "symbol": "GoodBadgeComponent"
      },
      "usageGuide": "guides/components/badge.md",
      "penpotCount": 1
    },
    {
      "selector": "good-brand-icon",
      "className": "GoodBrandIconComponent",
      "file": "components/good-brand-icon.json",
      "import": {
        "package": "@goodui/angular",
        "symbol": "GoodBrandIconComponent"
      },
      "usageGuide": null,
      "penpotCount": 1
    },
    {
      "selector": "good-breadcrumbs",
      "className": "GoodBreadcrumbsComponent",
      "file": "components/good-breadcrumbs.json",
      "import": {
        "package": "@goodui/angular",
        "symbol": "GoodBreadcrumbsComponent"
      },
      "usageGuide": "guides/components/breadcrumbs.md",
      "penpotCount": 1
    },
    {
      "selector": "good-button",
      "className": "GoodButtonComponent",
      "file": "components/good-button.json",
      "import": {
        "package": "@goodui/angular",
        "symbol": "GoodButtonComponent"
      },
      "usageGuide": "guides/components/button.md",
      "penpotCount": 1
    },
    {
      "selector": "good-calendar",
      "className": "GoodCalendarComponent",
      "file": "components/good-calendar.json",
      "import": {
        "package": "@goodui/angular",
        "symbol": "GoodCalendarComponent"
      },
      "usageGuide": "guides/components/calendar.md",
      "penpotCount": 16
    },
    {
      "selector": "good-card",
      "className": "GoodCardComponent",
      "file": "components/good-card.json",
      "import": {
        "package": "@goodui/angular",
        "symbol": "GoodCardComponent"
      },
      "usageGuide": "guides/components/card.md",
      "penpotCount": 1
    },
    {
      "selector": "good-card-footer",
      "className": "GoodCardFooterComponent",
      "file": "components/good-card-footer.json",
      "import": {
        "package": "@goodui/angular",
        "symbol": "GoodCardFooterComponent"
      },
      "usageGuide": null,
      "penpotCount": 1
    },
    {
      "selector": "good-card-header",
      "className": "GoodCardHeaderComponent",
      "file": "components/good-card-header.json",
      "import": {
        "package": "@goodui/angular",
        "symbol": "GoodCardHeaderComponent"
      },
      "usageGuide": null,
      "penpotCount": 1
    },
    {
      "selector": "good-checkbox",
      "className": "GoodCheckboxComponent",
      "file": "components/good-checkbox.json",
      "import": {
        "package": "@goodui/angular",
        "symbol": "GoodCheckboxComponent"
      },
      "usageGuide": "guides/components/checkbox.md",
      "penpotCount": 1
    },
    {
      "selector": "good-citation",
      "className": "GoodCitationComponent",
      "file": "components/good-citation.json",
      "import": {
        "package": "@goodui/angular",
        "symbol": "GoodCitationComponent"
      },
      "usageGuide": null,
      "penpotCount": 1
    },
    {
      "selector": "good-code-block",
      "className": "GoodCodeBlockComponent",
      "file": "components/good-code-block.json",
      "import": {
        "package": "@goodui/angular",
        "symbol": "GoodCodeBlockComponent"
      },
      "usageGuide": "guides/components/code-block.md",
      "penpotCount": 1
    },
    {
      "selector": "good-date-input",
      "className": "GoodDateInputComponent",
      "file": "components/good-date-input.json",
      "import": {
        "package": "@goodui/angular",
        "symbol": "GoodDateInputComponent"
      },
      "usageGuide": "guides/components/date-input.md",
      "penpotCount": 5
    },
    {
      "selector": "good-dropdown",
      "className": "GoodDropdownComponent",
      "file": "components/good-dropdown.json",
      "import": {
        "package": "@goodui/angular",
        "symbol": "GoodDropdownComponent"
      },
      "usageGuide": "guides/components/dropdown.md",
      "penpotCount": 4
    },
    {
      "selector": "good-error-page",
      "className": "GoodErrorPageComponent",
      "file": "components/good-error-page.json",
      "import": {
        "package": "@goodui/angular",
        "symbol": "GoodErrorPageComponent"
      },
      "usageGuide": "guides/components/error-page.md",
      "penpotCount": 2
    },
    {
      "selector": "good-error-text",
      "className": "GoodErrorTextComponent",
      "file": "components/good-error-text.json",
      "import": {
        "package": "@goodui/angular",
        "symbol": "GoodErrorTextComponent"
      },
      "usageGuide": null,
      "penpotCount": 1
    },
    {
      "selector": "good-eyebrow",
      "className": "GoodEyebrowComponent",
      "file": "components/good-eyebrow.json",
      "import": {
        "package": "@goodui/angular",
        "symbol": "GoodEyebrowComponent"
      },
      "usageGuide": null,
      "penpotCount": 1
    },
    {
      "selector": "good-field-label",
      "className": "GoodFieldLabelComponent",
      "file": "components/good-field-label.json",
      "import": {
        "package": "@goodui/angular",
        "symbol": "GoodFieldLabelComponent"
      },
      "usageGuide": null,
      "penpotCount": 1
    },
    {
      "selector": "good-form-field",
      "className": "GoodFormFieldComponent",
      "file": "components/good-form-field.json",
      "import": {
        "package": "@goodui/angular",
        "symbol": "GoodFormFieldComponent"
      },
      "usageGuide": null,
      "penpotCount": 3
    },
    {
      "selector": "good-form-row",
      "className": "GoodFormRowComponent",
      "file": "components/good-form-row.json",
      "import": {
        "package": "@goodui/angular",
        "symbol": "GoodFormRowComponent"
      },
      "usageGuide": null,
      "penpotCount": 2
    },
    {
      "selector": "good-group",
      "className": "GoodGroupComponent",
      "file": "components/good-group.json",
      "import": {
        "package": "@goodui/angular",
        "symbol": "GoodGroupComponent"
      },
      "usageGuide": "guides/components/group.md",
      "penpotCount": 4
    },
    {
      "selector": "good-heading",
      "className": "GoodHeadingComponent",
      "file": "components/good-heading.json",
      "import": {
        "package": "@goodui/angular",
        "symbol": "GoodHeadingComponent"
      },
      "usageGuide": null,
      "penpotCount": 1
    },
    {
      "selector": "good-heading-group",
      "className": "GoodHeadingGroupComponent",